rank,_input,prodLink,name,asin,salesprice
1,Dyson Fans,https://www.amazon.com/gp/slredirect/picassoRedirect.html/ref=pa_sp_atf_aps_sr_pg1_1?ie=UTF8&adId=A037956612KC1KQQIWMGR&url=%2FOcean-Loong-AB18G-Circulator-Conditioner%2Fdp%2FB08CBVTFGW%2Fref%3Dsr_1_1_sspa%3Fdchild%3D1%26keywords%3Ddyson%2Bfan%26qid%3D1614762611%26sr%3D8-1-spons%26psc%3D1&qualifier=1614762611&id=1203245652556898&widgetName=sp_atf,"AB18G Bladeless Tower Fan, 9 Speeds & 32 inchs Leafless Fan with Remote Control,Air Circulator Fan for Home Air Conditioner, Grey/Silver…",B08CBVTFGW,$135.00
2,Dyson Fans,https://www.amazon.com/Dyson-Multiplier-Table-Inches-Silver/dp/B00I8R4DLO/ref=sr_1_2?dchild=1&keywords=dyson+fan&qid=1614762611&sr=8-2,"Dyson Air Multiplier AM06 Table Fan, 10 Inches, White/Silver",B00I8R4DLO,$272.00
3,Dyson Fans,https://www.amazon.com/Dyson-Multiplier-AM06-Table-Inches/dp/B00KX1OD1S/ref=sr_1_3?dchild=1&keywords=dyson+fan&qid=1614762611&sr=8-3,"Dyson Air Multiplier AM06 Table Fan, 10 Inches - Black/Iron",B00KX1OD1S,$280.00
4,Dyson Fans,https://www.amazon.com/Dyson-Multiplier-Tower-White-Silver/dp/B00I8R4VZC/ref=sr_1_4?dchild=1&keywords=dyson+fan&qid=1614762611&sr=8-4,"Dyson Cool AM07 Air Multiplier Tower Fan, White/Silver",B00I8R4VZC,$449.99
5,Dyson Fans,https://www.amazon.com/Dyson-Focus-Heater-Black-Nickel/dp/B00SMLKEUK/ref=sr_1_5?dchild=1&keywords=dyson+fan&qid=1614762611&sr=8-5,"Dyson Hot + Cool Jet Focus AM09 Fan Heater, Black/Nickel",B00SMLKEUK,$449.99
6,Dyson Fans,https://www.amazon.com/Ocean-Loong-AB18G-Circulator-Conditioner/dp/B08CBVTFGW/ref=sr_1_6?dchild=1&keywords=dyson+fan&qid=1614762611&sr=8-6,"AB18G Bladeless Tower Fan, 9 Speeds & 32 inchs Leafless Fan with Remote Control,Air Circulator Fan for Home Air Conditioner, Grey/Silver…",B08CBVTFGW,$135.00
7,Dyson Fans,https://www.amazon.com/Ocean-Loong-Bladeless-Remote-Control/dp/B07YX17CHC/ref=sr_1_7?dchild=1&keywords=dyson+fan&qid=1614762611&sr=8-7,"AB01 Bladeless Tower Fan, 26 Inches 9 Speeds & 9H Timer Table Fan, White Air Circulator Fan for Bedroom Office",B07YX17CHC,$119.00
8,Dyson Fans,https://www.amazon.com/Dyson-AM07-Mini-Multiplier-Silver/dp/B00LX4IRZM/ref=sr_1_8?dchild=1&keywords=dyson+fan&qid=1614762611&sr=8-8,Dyson Cool AM07 Mini Air Multiplier Tower Fan White/Silver,B00LX4IRZM,$449.99
9,Dyson Fans,https://www.amazon.com/Honeywell-HYF290B-Quietset-Whole-Room-Oscillating/dp/B01N0LQJN6/ref=sr_1_9?dchild=1&keywords=dyson+fan&qid=1614762611&sr=8-9,"Honeywell QuietSet Whole Room Tower Fan-Black, HYF290B",B01N0LQJN6,$62.99
10,Dyson Fans,https://www.amazon.com/ULTTY-Purifier-Standing-Control-Oscillating/dp/B087LSVJPZ/ref=sr_1_10?dchild=1&keywords=dyson+fan&qid=1614762611&sr=8-10,ULTTY Bladeless Fan and Air Purifier in one | True HEPA Filter 99.97% Smoke Dust Pollen Dander | Oscillating Tower Fan with Remote Control R21 White,B087LSVJPZ,$142.99
11,Dyson Fans,https://www.amazon.com/Lasko-2264QM-Velocity-QuickMount-Black/dp/B004IS6JBY/ref=sr_1_11?dchild=1&keywords=dyson+fan&qid=1614762611&sr=8-11,"Lasko 20"" High Velocity Quick Mount, Easily Converts from a Floor Wall Fan, 7 x 22 x 22 inches, Black 2264QM",B004IS6JBY,$63.99
12,Dyson Fans,https://www.amazon.com/Lasko-T42951-Portable-Oscillating-13x13x42-5/dp/B000RL3UJA/ref=sr_1_12?dchild=1&keywords=dyson+fan&qid=1614762611&sr=8-12,"Lasko Portable Electric 42"" Oscillating Tower Fan with Nighttime Setting, Timer and Remote Control for Indoor, Bedroom and Home Office Use, Silver T42951",B000RL3UJA,
13,Dyson Fans,https://www.amazon.com/Bladeless-Heater-Control-Circulator-Conditioner/dp/B08CX44BKH/ref=sr_1_13?dchild=1&keywords=dyson+fan&qid=1614762611&sr=8-13,"AB09 Bladeless Heater Fan & 9 Speeds 32 Inchs Tower Fan with Remote Control, 1900W Space Heater and Air Circulator Fan for Home Air Conditioner, White/Blue",B08CX44BKH,$179.00
14,Dyson Fans,https://www.amazon.com/HONEYWELL-Dreamweaver-Sleep-Fan-Black/dp/B07M5N3KFQ/ref=sr_1_14?dchild=1&keywords=dyson+fan&qid=1614762611&sr=8-14,Honeywell Dreamweaver Sleep Black – Personal Fan with Pink Noise – USB Charging Port and On/Off Airflow for Use in Any Season,B07M5N3KFQ,$59.99
15,Dyson Fans,https://www.amazon.com/Dyson-Focus-Heater-White-Silver/dp/B00SMLKEPA/ref=sr_1_15?dchild=1&keywords=dyson+fan&qid=1614762611&sr=8-15,Dyson (61874-01) Hot + Cool Jet Focus AM09 Fan Heater White/Silver,B00SMLKEPA,
16,Dyson Fans,https://www.amazon.com/Dyson-AM09-Heater-Nickel-Control/dp/B01N3A9N2H/ref=sr_1_16?dchild=1&keywords=dyson+fan&qid=1614762611&sr=8-16,Dyson AM09 Hot + Cool Ceramic Fan Heater - Black/Iron,B01N3A9N2H,$559.00
17,Dyson Fans,https://www.amazon.com/Dyson-Wi-Fi-Enabled-Purifier-Silver/dp/B01IBRTN88/ref=sr_1_17?dchild=1&keywords=dyson+fan&qid=1614762611&sr=8-17,"Dyson Pure Hot + Cool Link HP02 Wi-Fi Enabled Air Purifier,White/Silver",B01IBRTN88,
18,Dyson Fans,https://www.amazon.com/Dyson-AM09-Pedestal-Heater-combo/dp/B07BNSZ9SP/ref=sr_1_18?dchild=1&keywords=dyson+fan&qid=1614762611&sr=8-18,"Dyson AM09 Iron Red, Pedestal Fan and Heater Combo",B07BNSZ9SP,
19,Dyson Fans,https://www.amazon.com/Lasko-1843-Pedestal-Oscillating-Adjustable/dp/B001V8Y64Q/ref=sr_1_19?dchild=1&keywords=dyson+fan&qid=1614762611&sr=8-19,"Lasko 1843 18″ Remote Control Cyclone Pedestal Fan with Built-in Timer, Black Features Oscillating Movement and Adjustable Height",B001V8Y64Q,
20,Dyson Fans,https://www.amazon.com/Molekule-Purifier-Purification-Technology-White/dp/B07ZPLXB54/ref=sr_1_20?dchild=1&keywords=dyson+fan&qid=1614762611&sr=8-20,"Molekule Air Mini Small Room Air Purifier with PECO Technology for Allergens, Pollutants, Viruses, Bacteria, and Mold, White",B07ZPLXB54,$299.00
21,Dyson Fans,https://www.amazon.com/Dyson-Replacement-Remote-Control-965824-01/dp/B06VTD369R/ref=sr_1_21?dchild=1&keywords=dyson+fan&qid=1614762611&sr=8-21,Dyson Replacement Remote Control 965824-01 for Models AM06 AM07 and AM08,B06VTD369R,
22,Dyson Fans,https://www.amazon.com/Dyson-Soft-Roller-Cleaner-Models/dp/B07SW7BGD7/ref=sr_1_22?dchild=1&keywords=dyson+fan&qid=1614762611&sr=8-22,Dyson Soft Roller Cleaner Head for Dyson Models (For V11 Models),B07SW7BGD7,$130.00
23,Dyson Fans,https://www.amazon.com/Dyson-Remote-Control-Purifying-967197-13/dp/B087V61NZQ/ref=sr_1_23?dchild=1&keywords=dyson+fan&qid=1614762611&sr=8-23,"Dyson Remote Control (White) for Pure Hot+Cool HP01 Purifying Heater + Fan, Part No. 967197-13",B087V61NZQ,
24,Dyson Fans,https://www.amazon.com/gp/slredirect/picassoRedirect.html/ref=pa_sp_mtf_aps_sr_pg1_1?ie=UTF8&adId=A04073162QGMSRWASJW6T&url=%2FHoneywell-HTF210B-Quiet-Personal-Table%2Fdp%2FB00YU1O15U%2Fref%3Dsr_1_24_sspa%3Fdchild%3D1%26keywords%3Ddyson%2Bfan%26qid%3D1614762611%26sr%3D8-24-spons%26psc%3D1&qualifier=1614762611&id=1203245652556898&widgetName=sp_mtf,Honeywell HTF210B Quiet Set Personal Table Fan,B00YU1O15U,$24.99
25,Dyson Fans,https://www.amazon.com/gp/slredirect/picassoRedirect.html/ref=pa_sp_mtf_aps_sr_pg1_1?ie=UTF8&adId=A00535452HPSQVE59ILJB&url=%2FHONEYWELL-Dreamweaver-Sleep-Fan-Black%2Fdp%2FB07M5N3KFQ%2Fref%3Dsr_1_25_sspa%3Fdchild%3D1%26keywords%3Ddyson%2Bfan%26qid%3D1614762611%26sr%3D8-25-spons%26psc%3D1&qualifier=1614762611&id=1203245652556898&widgetName=sp_mtf,Honeywell Dreamweaver Sleep Black – Personal Fan with Pink Noise – USB Charging Port and On/Off Airflow for Use in Any Season,B07M5N3KFQ,$59.99
26,Dyson Fans,https://www.amazon.com/gp/slredirect/picassoRedirect.html/ref=pa_sp_mtf_aps_sr_pg1_1?ie=UTF8&adId=A08397712ZZ26B652K0XJ&url=%2FOcean-Loong-Bladeless-Remote-Control%2Fdp%2FB07YX17CHC%2Fref%3Dsr_1_26_sspa%3Fdchild%3D1%26keywords%3Ddyson%2Bfan%26qid%3D1614762611%26sr%3D8-26-spons%26psc%3D1&qualifier=1614762611&id=1203245652556898&widgetName=sp_mtf,"AB01 Bladeless Tower Fan, 26 Inches 9 Speeds & 9H Timer Table Fan, White Air Circulator Fan for Bedroom Office",B07YX17CHC,$119.00
27,Dyson Fans,https://www.amazon.com/Dyson-Purifier-Replacement-Filter-purifiers/dp/B01MUH05PL/ref=sr_1_27?dchild=1&keywords=dyson+fan&qid=1614762611&sr=8-27,Dyson Purifier Replacement Filter Pure Cool Link Desk & Dyson Pure Hot+Cool Link purifiers,B01MUH05PL,$99.99
28,Dyson Fans,https://www.amazon.com/Dyson-Replacement-Remote-Control-966538-01/dp/B079FJ5LMQ/ref=sr_1_28?dchild=1&keywords=dyson+fan&qid=1614762611&sr=8-28,Dyson Replacement Remote Control 966538-01 for Fan Heater Model AM09 White,B079FJ5LMQ,
29,Dyson Fans,https://www.amazon.com/Dyson-Remote-Control-Purifying-969154-02/dp/B07Z7S51LK/ref=sr_1_29?dchild=1&keywords=dyson+fan&qid=1614762611&sr=8-29,"Dyson Remote Control (White) for TP04 Pure Cool Purifying Fan, Part No. 969154-02",B07Z7S51LK,$44.49
30,Dyson Fans,https://www.amazon.com/MOOSOO-Purifier-Bedroom-Airborne-Contaminants/dp/B08DL2MS1H/ref=sr_1_30?dchild=1&keywords=dyson+fan&qid=1614762611&sr=8-30,MOOSOO HEPA Air Purifier for Home Air Purifier with H13 HEPA Filter for Bedroom Pet Hair Dander Pollen Smoke Dust Airborne Contaminants Odors Home Air Purifier AC24,B08DL2MS1H,$109.99
31,Dyson Fans,https://www.amazon.com/Dyson-Purifier-Filter-Activated-Carbon/dp/B07Q74NRDB/ref=sr_1_31?dchild=1&keywords=dyson+fan&qid=1614762611&sr=8-31,Dyson DP04 HP04 TP04 Pure Cool Purifier Fan Glass HEPA Filter & Inner Activated Carbon Filter,B07Q74NRDB,$128.00
32,Dyson Fans,https://www.amazon.com/AIRMEGA-Smarter-Purifier-Covers-1560/dp/B01C9RIACG/ref=sr_1_32?dchild=1&keywords=dyson+fan&qid=1614762611&sr=8-32,"Coway Airmega 400 Smart Air Purifier with 1,560 sq. ft. Coverage",B01C9RIACG,$495.29
33,Dyson Fans,https://www.amazon.com/HIMOX-Purifier-Extra-Large-Adjustable-Purifiers/dp/B08913ZW9L/ref=sr_1_33?dchild=1&keywords=dyson+fan&qid=1614762611&sr=8-33,"HIMOX H05 Smart Air Purifier Extra-Large Room for 1446 Sq Ft/h with High-precision Automatic Sensors, Medical Grade H13 HEPA Filter, Adjustable Timer, Ultra Quiet Sleep Mode, Air Cleaner Purifiers 99.9% Removal of Dust Mold Allergens Smoke, Fit for Home Bedroom Living Room",B08913ZW9L,$189.99
34,Dyson Fans,https://www.amazon.com/Colorfullife-Replacement-Purifier-Compare-968126-03/dp/B07Q5RN6MD/ref=sr_1_34?dchild=1&keywords=dyson+fan&qid=1614762611&sr=8-34,"Colorfullife 2 Pack TP02, TP03 Replacement Air Purifier Filter for Dyson Tower Purifier Pure Cool Link TP02, TP03, Compare to Part 968126-03",B07Q5RN6MD,$32.99
35,Dyson Fans,https://www.amazon.com/Dyson-Purifier-Space-Heater-Silver/dp/B07KXBX32V/ref=sr_1_35?dchild=1&keywords=dyson+fan&qid=1614762611&sr=8-35,"Dyson Pure Hot + Cool, HP01 HEPA Air Purifier, Space Heater & Fan, For Large Rooms, Removes Allergens, Pollutants, Dust, Mold, VOCs, White/Silver",B07KXBX32V,
36,Dyson Fans,https://www.amazon.com/Dyson-Tower-Purifier-Replacement-Filter/dp/B0743M22DF/ref=sr_1_36?dchild=1&keywords=dyson+fan&qid=1614762611&sr=8-36,"Dyson Air Purifier Replacement (TP01, TP02, BP01) 360° Glass HEPA Filter, Silver/Green",B0743M22DF,
37,Dyson Fans,https://www.amazon.com/Rechargeable-Electrical-Purifying-Respirator-Housework/dp/B08D3HTQ6N/ref=sr_1_37?dchild=1&keywords=dyson+fan&qid=1614762611&sr=8-37,"Rechargeable Electrical Air Purifying Respirator, Reusable 3 Speeds Fan Modes Air Purifier with HEPA Filter for Outdoor Sports Housework",B08D3HTQ6N,$64.99
38,Dyson Fans,https://www.amazon.com/Dyson-Replacement-Remote-Control-966538-04/dp/B079FDL4ZR/ref=sr_1_38?dchild=1&keywords=dyson+fan&qid=1614762611&sr=8-38,Dyson Replacement Remote Control 966538-04 for Fan Heater Model AM09,B079FDL4ZR,
39,Dyson Fans,https://www.amazon.com/LivePure-Bladeless-Auto-Duster-Oscillating-Circulator/dp/B087D615ZK/ref=sr_1_39?dchild=1&keywords=dyson+fan&qid=1614762611&sr=8-39,"LivePure Bladeless Auto-Duster, Oscillating Fan w/Filter, Air Circulator, 11.5 x 22.44 x 6.73 in, Graphite",B087D615ZK,$116.90
40,Dyson Fans,https://www.amazon.com/Lhari-Replacement-Filter-Compatible-968125-03/dp/B0895FDWQ6/ref=sr_1_40?dchild=1&keywords=dyson+fan&qid=1614762611&sr=8-40,"Lhari HEPA Replacement Filter, Compatible with Dyson Pure Cool Link DP01, DP03, Pure Hot + Cool Link HP00, HP01 HP02, HP03, Part # 968125-03",B0895FDWQ6,$16.59
41,Dyson Fans,https://www.amazon.com/VEVA-Replacement-Compatible-968126-03-305158-01/dp/B07PY5JRKY/ref=sr_1_41?dchild=1&keywords=dyson+fan&qid=1614762611&sr=8-41,"VEVA Premium HEPA Replacement Filter 2 Pack Compatible with All Dyson Pure Cool Link Models TP01, TP02, TP03, BP01, Part # 968126-03# 305158-01",B07PY5JRKY,$39.99
42,Dyson Fans,https://www.amazon.com/isinlive-Replacement-Purifier-Activated-Filter%C2%A1%C2%AD/dp/B08L8XGSLT/ref=sr_1_42?dchild=1&keywords=dyson+fan&qid=1614762611&sr=8-42,isinlive 2 Pack Hepa Filter Replacement for Dyson HP04 TP04 DP04 Air Purifier Sealed Two Stage 360¡ã Filter System Pure Cool Purifier Fan HEPA Filter & Activated Carbon Filter¡­,B08L8XGSLT,$68.99
43,Dyson Fans,https://www.amazon.com/Molekule-Purifier-Purification-Technology-Silver/dp/B07YT95V42/ref=sr_1_43?dchild=1&keywords=dyson+fan&qid=1614762611&sr=8-43,"Molekule Air Large Room Air Purifier with PECO Technology for Allergens, Pollutants, Viruses, Bacteria, and Mold, Silver",B07YT95V42,$748.31
44,Dyson Fans,https://www.amazon.com/Bladeless-Control-Airflow-Leafless-Fan%EF%BC%8CGrey/dp/B084G6HXKG/ref=sr_1_44?dchild=1&keywords=dyson+fan&qid=1614762611&sr=8-44,"AB09 Bladeless Heater Fan & 9 Speeds 32 Inchs Tower Fan with Remote Control, 1900W Space Heater and Nature Airflow Leafless Fan，Grey/Silver",B084G6HXKG,$189.00
45,Dyson Fans,https://www.amazon.com/Dyson-Cool-Purifier-Non-Compatible/dp/B075W92C14/ref=sr_1_45?dchild=1&keywords=dyson+fan&qid=1614762611&sr=8-45,Dyson Hot + Cool Air Purifier -Non WiFi Compatible,B075W92C14,
46,Dyson Fans,https://www.amazon.com/Dyson-Replacement-remote-control-Compatible/dp/B079F8S6S3/ref=sr_1_46?dchild=1&keywords=dyson+fan&qid=1614762611&sr=8-46,Dyson Part no. 922662-08 Replacement remote control Compatible with Dyson AM04 fan heater,B079F8S6S3,$42.99
47,Dyson Fans,https://www.amazon.com/LivePure-Blade-Bladeless-Circulating-inches/dp/B087D65HVK/ref=sr_1_47?dchild=1&keywords=dyson+fan&qid=1614762611&sr=8-47,"LivePure Blade, Tall Bladeless Fan, Air Circulating Tower, 11.22 x 10.95 x 43.31 inches, 8.6 lbs, White",B087D65HVK,$99.99
48,Dyson Fans,https://www.amazon.com/Dyson-Remote-Control-Purifying-969154-01/dp/B07Z7SMKX2/ref=sr_1_48?dchild=1&keywords=dyson+fan&qid=1614762611&sr=8-48,"Dyson Remote Control (Blue) for TP04 Pure Cool Purifying Fan, Part No. 969154-01",B07Z7SMKX2,$63.99
49,Dyson Fans,https://www.amazon.com/Lasko-2535-Space-Saving-Pedestal-Control/dp/B000RMJANY/ref=sr_1_49?dchild=1&keywords=dyson+fan&qid=1614762611&sr=8-49,Lasko 2535 52″ Space-Saving Pedestal Tower Fan with Remote Control - Features Built-in Timer and Wide Spread Oscillation,B000RMJANY,
50,Dyson Fans,https://www.amazon.com/Vornado-Full-Size-Circulator-Adjustable-Height/dp/B000E5XNAK/ref=sr_1_50?dchild=1&keywords=dyson+fan&qid=1614762611&sr=8-50,Vornado 783 Full-Size Whole Room Air Circulator Fan with Adjustable Height,B000E5XNAK,$129.99
51,Dyson Fans,https://www.amazon.com/gp/slredirect/picassoRedirect.html/ref=pa_sp_btf_aps_sr_pg1_1?ie=UTF8&adId=A03149702PCDT1TIHH5XO&url=%2FBladeless-Heater-Control-Circulator-Conditioner%2Fdp%2FB08CX44BKH%2Fref%3Dsr_1_51_sspa%3Fdchild%3D1%26keywords%3Ddyson%2Bfan%26qid%3D1614762611%26sr%3D8-51-spons%26psc%3D1&qualifier=1614762611&id=1203245652556898&widgetName=sp_btf,"AB09 Bladeless Heater Fan & 9 Speeds 32 Inchs Tower Fan with Remote Control, 1900W Space Heater and Air Circulator Fan for Home Air Conditioner, White/Blue",B08CX44BKH,$179.00
52,Dyson Fans,https://www.amazon.com/gp/slredirect/picassoRedirect.html/ref=pa_sp_btf_aps_sr_pg1_1?ie=UTF8&adId=A03732961RUK0NK5TKPGJ&url=%2FRowenta-Oscillating-Control-Standing-5-Speed%2Fdp%2FB071JBX9MQ%2Fref%3Dsr_1_52_sspa%3Fdchild%3D1%26keywords%3Ddyson%2Bfan%26qid%3D1614762611%26sr%3D8-52-spons%26psc%3D1&qualifier=1614762611&id=1203245652556898&widgetName=sp_btf,"Rowenta VU5670 Turbo Silence Oscillating Fan, Standing Fan, 5 Speed Fan with Remote Control",B071JBX9MQ,$121.93
53,Dyson Fans,https://www.amazon.com/gp/slredirect/picassoRedirect.html/ref=pa_sp_btf_aps_sr_pg1_1?ie=UTF8&adId=A0576249185GVVVLERX46&url=%2FDyson-Remote-Control-Heater-966538-02%2Fdp%2FB07Z7T5PJN%2Fref%3Dsr_1_53_sspa%3Fdchild%3D1%26keywords%3Ddyson%2Bfan%26qid%3D1614762611%26sr%3D8-53-spons%26psc%3D1&qualifier=1614762611&id=1203245652556898&widgetName=sp_btf,"Dyson Remote Control (Iron) for AM09 Hot + Cool Heater Fan, Part No. 966538-02",B07Z7T5PJN,$63.54
54,Dyson Fans,https://www.amazon.com/gp/slredirect/picassoRedirect.html/ref=pa_sp_btf_aps_sr_pg1_1?ie=UTF8&adId=A01901432A6A4L1BQFU6I&url=%2FULTTY-Purifier-Standing-Control-Oscillating%2Fdp%2FB087LSVJPZ%2Fref%3Dsr_1_54_sspa%3Fdchild%3D1%26keywords%3Ddyson%2Bfan%26qid%3D1614762611%26sr%3D8-54-spons%26psc%3D1%26smid%3DAN6RSGGPMRUM1&qualifier=1614762611&id=1203245652556898&widgetName=sp_btf,ULTTY Bladeless Fan and Air Purifier in one | True HEPA Filter 99.97% Smoke Dust Pollen Dander | Oscillating Tower Fan with Remote Control R21 White,B087LSVJPZ,$142.99
55,Dyson Fans,https://www.amazon.com/gp/slredirect/picassoRedirect.html/ref=pa_sp_btf_aps_sr_pg1_1?ie=UTF8&adId=A09650592ZB19XC8LFLGN&url=%2FDista-Filter-Replacement-Compatible-No-970341-01%2Fdp%2FB08G6F9161%2Fref%3Dsr_1_55_sspa%3Fdchild%3D1%26keywords%3Ddyson%2Bfan%26qid%3D1614762611%26sr%3D8-55-spons%26psc%3D1&qualifier=1614762611&id=1203245652556898&widgetName=sp_btf,"Dista Filter - Air Purifier Filter Replacement Compatible with Dyson HP06, TP06, PH01,PH02, (Part No.970341-01) for Dyson Pure Cool/Hot/Humidify CRYPTOMIC Tower Fan Purifiers (Qty 2)",B08G6F9161,$59.99
56,Dyson Fans,https://www.amazon.com/gp/slredirect/picassoRedirect.html/ref=pa_sp_btf_aps_sr_pg1_1?ie=UTF8&adId=A037044438RVL5E0CMJL9&url=%2FDyson-919591-01-Replacement-remote-control%2Fdp%2FB0797XLL19%2Fref%3Dsr_1_56_sspa%3Fdchild%3D1%26keywords%3Ddyson%2Bfan%26qid%3D1614762611%26sr%3D8-56-spons%26psc%3D1&qualifier=1614762611&id=1203245652556898&widgetName=sp_btf,Dyson 919591-01 Replacement remote control AM03 Dyson AM03 Pedestal Fan Iron/Blue AM02 Dyson AM02 fan,B0797XLL19,$64.99
57,Dyson Fans,https://www.amazon.com/Dyson-Remote-Control-Purifying-969897-02/dp/B07Z7SG3NR/ref=sr_1_57?dchild=1&keywords=dyson+fan&qid=1614762611&sr=8-57,"Dyson Remote Control (Blue) for HP04 Hot + Cool Purifying Heater Fan, Part No. 969897-02",B07Z7SG3NR,$53.99
58,Dyson Fans,https://www.amazon.com/Genuine-Dyson-Release-Adaptor-967752-01/dp/B07D1R39S7/ref=sr_1_58?dchild=1&keywords=dyson+fan&qid=1614762611&sr=8-58,Genuine Dyson V7 V8 Quick Release Up Top Adaptor Tool 967752-01,B07D1R39S7,
59,Dyson Fans,https://www.amazon.com/gp/slredirect/picassoRedirect.html/ref=pa_sp_atf_next_aps_sr_pg2_1?ie=UTF8&adId=A08397712ZZ26B652K0XJ&url=%2FOcean-Loong-Bladeless-Remote-Control%2Fdp%2FB07YX17CHC%2Fref%3Dsr_1_49_sspa%3Fdchild%3D1%26keywords%3Ddyson%2Bfan%26qid%3D1614762620%26sr%3D8-49-spons%26psc%3D1&qualifier=1614762620&id=8398453564586901&widgetName=sp_atf_next,"AB01 Bladeless Tower Fan, 26 Inches 9 Speeds & 9H Timer Table Fan, White Air Circulator Fan for Bedroom Office",B07YX17CHC,$119.00
60,Dyson Fans,https://www.amazon.com/gp/slredirect/picassoRedirect.html/ref=pa_sp_atf_next_aps_sr_pg2_1?ie=UTF8&adId=A04073162QGMSRWASJW6T&url=%2FHoneywell-HTF210B-Quiet-Personal-Table%2Fdp%2FB00YU1O15U%2Fref%3Dsr_1_50_sspa%3Fdchild%3D1%26keywords%3Ddyson%2Bfan%26qid%3D1614762620%26sr%3D8-50-spons%26psc%3D1&qualifier=1614762620&id=8398453564586901&widgetName=sp_atf_next,Honeywell HTF210B Quiet Set Personal Table Fan,B00YU1O15U,$24.99
61,Dyson Fans,https://www.amazon.com/gp/slredirect/picassoRedirect.html/ref=pa_sp_atf_next_aps_sr_pg2_1?ie=UTF8&adId=A03149702PCDT1TIHH5XO&url=%2FBladeless-Heater-Control-Circulator-Conditioner%2Fdp%2FB08CX44BKH%2Fref%3Dsr_1_51_sspa%3Fdchild%3D1%26keywords%3Ddyson%2Bfan%26qid%3D1614762620%26sr%3D8-51-spons%26psc%3D1&qualifier=1614762620&id=8398453564586901&widgetName=sp_atf_next,"AB09 Bladeless Heater Fan & 9 Speeds 32 Inchs Tower Fan with Remote Control, 1900W Space Heater and Air Circulator Fan for Home Air Conditioner, White/Blue",B08CX44BKH,$179.00
62,Dyson Fans,https://www.amazon.com/gp/slredirect/picassoRedirect.html/ref=pa_sp_atf_next_aps_sr_pg2_1?ie=UTF8&adId=A037956612KC1KQQIWMGR&url=%2FOcean-Loong-AB18G-Circulator-Conditioner%2Fdp%2FB08CBVTFGW%2Fref%3Dsr_1_52_sspa%3Fdchild%3D1%26keywords%3Ddyson%2Bfan%26qid%3D1614762620%26sr%3D8-52-spons%26psc%3D1&qualifier=1614762620&id=8398453564586901&widgetName=sp_atf_next,"AB18G Bladeless Tower Fan, 9 Speeds & 32 inchs Leafless Fan with Remote Control,Air Circulator Fan for Home Air Conditioner, Grey/Silver…",B08CBVTFGW,$135.00
63,Dyson Fans,https://www.amazon.com/Rowenta-Silence-Extreme-Electronic-control/dp/B06WD44Z47/ref=sr_1_53?dchild=1&keywords=dyson+fan&qid=1614762620&sr=8-53,"Rowenta VU2660 Turbo Silence Fan, Table Fan, Portable Fan, 5 Speed Fan with Remote Control",B06WD44Z47,$85.00
64,Dyson Fans,https://www.amazon.com/Black-Decker-inches-Frameless-Tabletop/dp/B06WP6CY4G/ref=sr_1_54?dchild=1&keywords=dyson+fan&qid=1614762620&sr=8-54,BLACK+DECKER Mini Box Fan – Tabletop Quiet 9 Inch Desk Box Fans Frameless BFB09W White,B06WP6CY4G,$17.30
65,Dyson Fans,https://www.amazon.com/Lasko-2510-White/dp/B001V9DYNO/ref=sr_1_55?dchild=1&keywords=dyson+fan&qid=1614762620&sr=8-55,"Lasko 2510 Oscillating Tower Fan, 36 Inch, White",B001V9DYNO,
66,Dyson Fans,https://www.amazon.com/Dyson-Remote-Control-Purifying-969154-04/dp/B07Z7R4RGY/ref=sr_1_56?dchild=1&keywords=dyson+fan&qid=1614762620&sr=8-56,"Dyson Remote Control (Blue) for DP04 Pure Cool Purifying Fan, Part No. 969154-04",B07Z7R4RGY,$64.99
67,Dyson Fans,https://www.amazon.com/Lasko-Wind-Curve-Tower-Size/dp/B000RL1WNQ/ref=sr_1_57?dchild=1&keywords=dyson+fan&qid=1614762620&sr=8-57,"Lasko Wind Curve Portable Electric 42"" Oscillating Tower Fan with Fresh Air Ionizer, Timer and Remote Control for Indoor, Bedroom and Home Office Use, Silverwood 2554",B000RL1WNQ,
68,Dyson Fans,https://www.amazon.com/Vornado-Mid-Size-Whole-Room-Circulator/dp/B000E5WAUO/ref=sr_1_58?dchild=1&keywords=dyson+fan&qid=1614762620&sr=8-58,Vornado 630 Mid-Size Whole Room Air Circulator Fan,B000E5WAUO,$64.99
69,Dyson Fans,https://www.amazon.com/Honeywell-Fresh-Breeze-Remote-Control/dp/B075SRW48D/ref=sr_1_49?dchild=1&keywords=dyson+fan&qid=1614762620&sr=8-49,"Honeywell Fresh Breeze Tower Fan with Remote Control HYF048 Black With Programmable Thermostat, Timer Shut-Off Function & Dust Filter",B075SRW48D,$69.99
70,Dyson Fans,https://www.amazon.com/Vornado-Whole-Room-Tower-Circulator/dp/B004HIAT2K/ref=sr_1_50?dchild=1&keywords=dyson+fan&qid=1614762620&sr=8-50,"Vornado 184 Whole Room Air Circulator Tower Fan, 41"", 184-41"", Black",B004HIAT2K,
71,Dyson Fans,https://www.amazon.com/Dyson-Replacement-Control-965824-07-Purifiers/dp/B079FNFQBB/ref=sr_1_51?dchild=1&keywords=dyson+fan&qid=1614762620&sr=8-51,Dyson Replacement Remote Control 965824-07 for Model AM11 Pure Cool Purifiers,B079FNFQBB,$57.03
72,Dyson Fans,https://www.amazon.com/BLACK-DECKER-BFT114-14-Inch-Tower/dp/B07SKC1TLJ/ref=sr_1_52?dchild=1&keywords=dyson+fan&qid=1614762620&sr=8-52,BLACK+DECKER Mini Tower Fan - Quiet Oscillating Stand up 14 Inch Desk Fans,B07SKC1TLJ,$21.97
73,Dyson Fans,https://www.amazon.com/Purifier-Zigma-Purifiers-Cleaners-Aerio-300/dp/B08BHRCLYL/ref=sr_1_53?dchild=1&keywords=dyson+fan&qid=1614762620&sr=8-53,"Zigma Air Purifier for Large Room up to 1580 ft2, Available for California, True HEPA 5-in-1 Smart Air Purifiers for Home w/Voice Control for Dust, Pollen, Pet Hair, Smoke, Air Cleaner for Bedroom, Office, Kitchen Aerio-300",B08BHRCLYL,$269.96
74,Dyson Fans,https://www.amazon.com/OION-Purifier-Speeds-Sanitizer-Black/dp/B073VXRQZW/ref=sr_1_54?dchild=1&keywords=dyson+fan&qid=1614762620&sr=8-54,OION 4-in-1 True HEPA Air Purifier 3 Speeds Plus UV-C Sanitizer (Black),B073VXRQZW,$57.95
75,Dyson Fans,https://www.amazon.com/gp/slredirect/picassoRedirect.html/ref=pa_sp_mtf_aps_sr_pg2_1?ie=UTF8&adId=A01901432A6A4L1BQFU6I&url=%2FULTTY-Purifier-Standing-Control-Oscillating%2Fdp%2FB087LSVJPZ%2Fref%3Dsr_1_55_sspa%3Fdchild%3D1%26keywords%3Ddyson%2Bfan%26qid%3D1614762620%26sr%3D8-55-spons%26psc%3D1%26smid%3DAN6RSGGPMRUM1&qualifier=1614762620&id=8398453564586901&widgetName=sp_mtf,ULTTY Bladeless Fan and Air Purifier in one | True HEPA Filter 99.97% Smoke Dust Pollen Dander | Oscillating Tower Fan with Remote Control R21 White,B087LSVJPZ,$142.99
76,Dyson Fans,https://www.amazon.com/10000mAh-Telescopic-Automatic-Oscillation-Adjustment/dp/B088JWVF7D/ref=sr_1_56?dchild=1&keywords=dyson+fan&qid=1614762620&sr=8-56,"10000mAh Telescopic Standing Fan, Portable Folding Fan Table Fan Floor Fan, Battery Operated Desk Fan with Automatic Oscillation, 3 Speed Settings, Height Adjustment, Super Quiet for Home, Outdoor",B088JWVF7D,$59.99
77,Dyson Fans,https://www.amazon.com/Dyson-AM01-table-fan-White/dp/B0076ZGGHI/ref=sr_1_57?dchild=1&keywords=dyson+fan&qid=1614762620&sr=8-57,"Dyson AM01 10"" table fan, White",B0076ZGGHI,
78,Dyson Fans,https://www.amazon.com/HealSmart-32-inch-Space-Heater-Bladeless/dp/B08SBL5JMQ/ref=sr_1_58?dchild=1&keywords=dyson+fan&qid=1614762620&sr=8-58,"HealSmart 32-inch Space Heater Bladeless Tower Fan, Heater & Fan Combo, 9H Timer 10 Speeds with Remote Control, Air Circulator Fan for Home Air Conditioner, White",B08SBL5JMQ,$149.99
79,Dyson Fans,https://www.amazon.com/Hestom-Purifier-Cleaner-Coverage-Negative/dp/B088R9YGWV/ref=sr_1_59?dchild=1&keywords=dyson+fan&qid=1614762620&sr=8-59,"Hestom Air Purifier for Home Large Room, H13 True HEPA Air Cleaner,1500 Sq Ft Coverage, Perfect for Pets, Low Noise, Auto Mode, 3 Fans Setting, Negative Ion, Matte White",B088R9YGWV,$269.50
80,Dyson Fans,https://www.amazon.com/Afloia-Purifier-Smokers-Allergies-Analysis/dp/B08K8D55YN/ref=sr_1_60?dchild=1&keywords=dyson+fan&qid=1614762620&sr=8-60,"Afloia Gala Air Purifier for Home Smokers Allergies and Pets Hair, Air Quality Analysis,True HEPA Filter Air Purifier for Bedroom",B08K8D55YN,$79.99
